Timed,InstantFeedback,Round,Category,Q,Type,Question,Image,Media,Answer,Details,OptA,OptB,OptC,OptD,OptE
FALSE,FALSE,0,,0,MD,,,,,,,,,,
FALSE,FALSE,0,Trivia Night,1,MC,It's time for some trivia! What's the theme for our Fall 2021 Trivia Night?,https://d3apq476edz7yu.cloudfront.net/inregister/2018/04/13949871_f1024-e1525203285545.jpg?q=60&crop=faces&fit=crop&w=1140&h=544&dpr=2,,E,,60s,Movie Night,70s,Music,80s
FALSE,FALSE,0,Trivia Night,2,MC,"The 80s is one of the most, if not the most, iconic decades in American history. Which of the following people were born in the 80s?",https://static.onecms.io/wp-content/uploads/sites/20/2020/10/19/people-1985-cover-1-2000.jpg,,"B, C, D",Barack Obama is from the 60s and  Harry Styles is from the 90s!,Barack Obama,Kim Kardashian,Taylor Swift,Lebron James,Harry Styles
TRUE,TRUE,0,Fruit,3,SA,"Okay, that's enough about the 80s! I am thinking of a fruit - what is it? Botanically, it is a berry and grows on vines. Its scientific name is Vitis and it comes in a variety of colors.",https://www.gardeningknowhow.com/wp-content/uploads/2020/11/branch-of-red-wine-grapes.jpg,,Grape,Fun fact! 71% of the world's grape produced is used for wine.,,,,,
TRUE,TRUE,0,Fruit,4,SA,"Through the year 2019, according to FAOSTAT, how many millions of tonnes of grapes did the world produce? Round your answer to the nearest whole number. This number is also prime and an emirp. ",,,79,"China is the world's biggest producer of grapes, followed by Italy and the United States.",,,,,
TRUE,TRUE,9,,0,,,,,,,,,,,
TRUE,TRUE,9,Zoomout,1,SA,Keep your eyes on the slides!,,,Footloose,,,,,,
TRUE,TRUE,9,Zoomout,2,SA,Keep your eyes on the slides!,,,Airplane,,,,,,
TRUE,TRUE,9,Zoomout,3,SA,Keep your eyes on the slides!,,,Indiana Jones,,,,,,
TRUE,TRUE,9,Zoomout,4,SA,Keep your eyes on the slides!,,,Ferris Bueller's Day Off,,,,,,
TRUE,TRUE,9,Zoomout,5,SA,Keep your eyes on the slides!,,,Pretty in Pink,,,,,,
TRUE,TRUE,9,Zoomout,6,SA,Keep your eyes on the slides!,,,The Karate Kid,,,,,,
TRUE,TRUE,9,Zoomout,7,SA,Keep your eyes on the slides!,,,E.T.,,,,,,
TRUE,TRUE,9,Zoomout,8,SA,Keep your eyes on the slides!,,,The Goonies,,,,,,
TRUE,TRUE,9,Zoomout,9,SA,Keep your eyes on the slides!,,,The Empire Strikes Back,,,,,,
TRUE,TRUE,9,Zoomout,10,SA,Keep your eyes on the slides!,,,Sixteen Candles,,,,,,
FALSE,FALSE,1,80s,0,MD,,,,,,,,,,
FALSE,FALSE,1,80s,1,MC,"One of the most out of this world discoveries in the 80s was that of Neptune’s rings. Neptune, the farthest known Solar System planet, is named after the Roman god of which of the following?",https://media.wired.com/photos/5d04042aea706e48d9bcd1bf/master/w_2560%2Cc_limit/Science-Neptune-TA-PIA01492_orig.jpg,,A,"Neptune is a Roman god, the counterpart to the Greek god Poseidon. He is the brother of Jupiter and Pluto.",Sea,Lightning,Beauty,Music,Wisdom
FALSE,FALSE,1,80s,2,MC,"Muhammad Ali retired from boxing for good in 1981 with 56 wins and only 5 losses. This legend of boxing, however, was not born with the name Muhammad Ali. What was his birth name?",https://www.washingtonpost.com/rf/image_1484w/2010-2019/WashingtonPost/2016/06/04/Web-Resampled/2016-06-04/1368864311465001651-kCMG--606x404@wp.com.jpg?t=20170517,,C,Ali is said to have changed his name after converting to Islam.,Elijah Muhammad,George Foreman,Cassius Clay Jr.,Rudolph Martin Jr.,Sonny Liston
FALSE,FALSE,1,80s,3,MC,The internet has had many iterations before reaching what we know today. Who invented what was known as the “World Wide Web” in 1989?,https://webfoundation.org/docs/2009/10/berners-lee.jpg,,B,"The first iteration was ARPANET, which was a four way military connection.",Bill Gates,Tim Berners-Lee,Howard Aiken,Charles Bachman,Alan Turing
FALSE,FALSE,1,80s,4,MC,"The historical eruption of Mount Saint Helens occurred in 1980, depositing ash in 11 states. This active volcano is found in which of the following mountain ranges?",https://upload.wikimedia.org/wikipedia/commons/d/dc/MSH82_st_helens_plume_from_harrys_ridge_05-19-82.jpg,,E,"Before the erruption, Mt. St. Helens was 9,677 ft. Now, it is approximately 8,300 ft.",Rocky Mountains,Appalachian Mountains,Alaska Range,Sierra Nevada,Cascade Range
FALSE,FALSE,1,80s,5,MC,"In the 80s show GI Joe, the tech-specialist Breaker is well-liked and a good member of the team, but he has what some might call a bad habit: what is it?
",https://image.api.playstation.com/vulcan/ap/rnd/202008/1723/KI9S6V8UHhDmet77Xdvwty3W.jpg,,E,"GI Joe has been developed into a toy, comic, and media franchise.",Smoking,Cracks knuckles,Taps pens,Picks nose,Chews gum
FALSE,FALSE,1,80s,6,MC,"Released in 1984, Alexey Pajitnov's block-stacking game called Tetris later became one of the highest selling games of all time. What are the colored blocks in Tetris called?",https://upload.wikimedia.org/wikipedia/commons/thumb/9/9c/Typical_Tetris_Game.svg/1200px-Typical_Tetris_Game.svg.png,,D,"The name ""Tetris"" comes from a combination of the Greek word 'tetra' and the creator's favorite sport, Tennis.",Tets,Tetrises,Quadblocks,Tetrominos,Tetroids
FALSE,FALSE,1,80s,7,MC,"80’s TV Shows are iconic, spawning spinoffs and remakes even today. Which 80’s TV show starred Alan Thicke, Kirk Cameron, Jeremy Miller, and Ashley Johnson?",https://metvcdn.metv.com/fP2qv-1525455371-630-quiz_question_image_-80s_inline.jpg,,C,Growing Pains ran for seven seasons and 166 episodes.,Full House,One Day at a Time,Growing Pains,Alf,Family Ties
FALSE,FALSE,1,80s,8,MC,"The Handmaid’s Tale by Margaret Atwood is often cited as a defining piece of 80’s literature, and it was recently developed into an Hulu TV series. What is the main character referred to as?",https://static01.nyt.com/images/2017/03/09/books/review/0319-BKS-Atwood-COVER/0319-BKS-Atwood-COVER-superJumbo.jpg,,A,The TV show has won a total of 15 primetime Emmy's,Offred,Ofglen,Glen,Sereja Joy,Ofwarren
FALSE,FALSE,1,80s,9,MC,"The Nike Air Max 1 was released in 1987, which was the first sneaker to offer the brand's patented Air cushioning. The shoelace of sneakers contain a small sheath named what?",https://static.wikia.nocookie.net/phineasandferb/images/1/1f/A-g-l-e-t.jpg/revision/latest?cb=20130408203404,,A,"As Phineas and Ferb say, A-G-L-E-T! Don't forget it! ",Aglet,Tilde,Tillet,Ferrule,Eyelet
FALSE,FALSE,1,80s,10,MC,"Frank Sinatra is considered one of the greatest artists of the 20th century with hits such as ""Fly Me to the Moon"". Which Frank Sinatra song did Scooby Doo’s name come from?","https://images2.minutemediacdn.com/image/upload/c_crop,h_1345,w_2000,x_0,y_72/v1554700730/shape/mentalfloss/66159-mgm.jpg?itok=rxuyrD3f",,E,"That’s right, the Great Dane’s name came from the Sinatra singing ""doo-be-doo-be-doo"" in Strangers in the Night.
",I Get a Kick Out of You,My Way,The Way You Look Tonight,This Love of Mine,Strangers in the Night
FALSE,FALSE,1,80s,11,MC,"The original Smurfs TV show was released in 1981, based on a Belgian comic series created by Peyo. In the original show, how many female smurfs were there?",https://www.thesun.co.uk/wp-content/uploads/2021/09/0d23e7ba-effd-4a31-97d4-b26dd3604f84.jpg,,D,"The 3 original female smurfs' names are Smurfette, Sassette, and Nanny.",0,1,2,3,4
FALSE,FALSE,1,80s,12,MC,"US sports teams change cities for various reasons such as financial woes or even weak fan support. Thinking back to the 1979-80 season for the NBA, which of the following teams was not present?",https://i1.wp.com/sportleaguemaps.com/wp-content/uploads/NBA-Map-Complete.png?ssl=1,,B,"The Brooklyn Nets were the New Jersey Nets this season, which was also the season the NBA introduced the 3-point line!",Washington Bullets,Brooklyn Nets,Kansas City Kings,Golden State Warriors,San Diego Cippers
FALSE,FALSE,1,80s,13,MC,"In 1985, Dairy Queen added a menu item: the infamous Blizzard, which sold $1.29 for a 12-ounce. Today, the same size sells for $3.69. While the Blizzard doesn’t perfectly measure inflation, which of the following would $1 in 1985 be worth today? ",https://baydq.com/media/8d89b817948b95f/blizzard.webp?mode=pad&rnd=132519095661430000,,B,"The Dairy Queen Blizzard may be frozen and creamy, but it's not labeled as ice cream, which according to the FDA, needs >10% butterfat! ",$1.19,$2.54,$4.04,$5.98,$6.98
FALSE,FALSE,1,80s,14,MC,"Leonardo, Raphael, Donatello, and Michelangelo make up the four Teenage Mutant Ninja Turtles, originally created in 1983. In the beginning, they all wore the same color bandana. What color were the bandanas?",https://assets1.ignimgs.com/2021/03/09/tmnt-new-game-1615289536411_160w.jpg?width=1280,,E,These turtles are named after famous Renaissance artists.,Blue,Orange,Purple,Black,Red
FALSE,FALSE,1,80s,15,MC,"International Record Syndicate, or I.R.S Record company managed a range of prominent punk artists from the 80s. Which of these artists was not signed under I.R.S. Records?",http://www.cvinyl.com/images/labels/irs1.jpg,,B,I.R.S. Records was founded in 1979 from Universal Music Group. ,R.E.M. ,The Pixies ,The Go-Go's ,Fine Young Cannibals ,General Public 
FALSE,FALSE,1,80s,16,MC,"Bob Ross is well known for painting happy little trees, but before he did so, he painted pans! Some even fetch $7500 on eBay today. Many modern pans are nonstick due to a Teflon coating, which is a synthetic chemical made of two of which of the following elements? ",https://yt3.ggpht.com/ytc/AKedOLT2y4hkt_FsZMoIkho6Vn8jFfGacOYxi2XkvuXL=s900-c-k-c0x00ffffff-no-rj,,"C,E","Teflon is the trading name for PFTE. It is valuable for its qualities of being chemical, temperature, and high corrosion resistant.",Hydrogen,Silicon,Carbon,Nitrogen,Fluorine
FALSE,FALSE,1,80s,18,MC,"The first Post-It note hit stores in 1980. Its adhesive was invented by alumni Spencer Silver from the University of Colorado Boulder, whose mascot is a female buffalo. What is a juvenile buffalo called?",https://dmgxuvvk0mgkf.cloudfront.net/images/2018/4/24/Ralphie_2017_Arizona_CliffGrassmick_71.JPG,,calf,"This year, CU Boulder debuted their sixth buffalo, Ralphie VI, retiring Ralphie V because she was too fast for the runners",,,,,
TRUE,FALSE,1,80s,17,SA,"Star Wars: Revenge of the Sith came out in 1980, which also introduced Jengo Fett's son, Boba Fett. What is Jengo Fett's ship name?",https://static.wikia.nocookie.net/29ff26b8-ae3f-459d-b228-ae0bf9829df7,,Slave I,"Boba Fett's ship name has actually been changed to FIrespray, which reflects it's model name.",,,,,
TRUE,FALSE,1,80s,19,SA,"The reminiscents of the Cold War started waning down as the Soviet Union faltered towards the end of the 80s. Symbolic of the fall of the USSR was the collapse of what on November 9th, 1989?",https://www.thetrumpet.com/files/W1siZiIsIjIwMTgvMTIvMjUvMjk1Yzc0MGZ6cF9Tb3ZpZXRfZXJhX0dldHR5SW1hZ2VzXzg5ODU2MjQxLmpwZyJdLFsicCIsInRodW1iIiwiMjA0OHgyMDQ4PiJdLFsicCIsImVuY29kZSIsImpwZyIsIi1xdWFsaXR5IDgwIl1d/11798504714755c4/Soviet%20era%20-%20GettyImages-89856241.jpg.jpg,,Berlin Wall,"The Berlin Wall actually fell due to a a mistaken answer to a press converence question, which resulted in crowds gathering outside the wall that night, reunifying Germany after 28 years.",,,,,
TRUE,FALSE,1,80s,20,SA,"Based in San Francisco, Huey Lewis and the News released a large number of hits in the 80s and 90s. Their popular song, ""The Power of Love"" was the theme song for what famous 80s movie?",https://static.onecms.io/wp-content/uploads/sites/6/2018/02/gettyimages-527702908-2000.jpg,,Back to the Future,Huey Lewis and the News had 19 top ten hits on the Billboard Hot 100 List. ,,,,,
FALSE,FALSE,2a,,0,MD,,,,,,,,,,
FALSE,FALSE,2a,,1,MC,"What country hosts the world's second largest lake, Lake Tanganyika, and the tallest mountain in Africa, Mount Kilimanjaro.",https://www.micato.com/wp-content/uploads/2018/09/mt-kilimanjaro.jpg,,A,"Tanzania is actually the mergance of two seperate states, Tanganyika and Zanzibar, who gained independence from the British in 1961 and 1963 respectively.",Tanzania,Kenya,Zambia,Ethiopia,Uganda
FALSE,FALSE,2a,,2,MC,"Zeus boasts the most children of any Greek God, totalling almost 100. Which of the following is NOT a child of Zeus?",https://www.greekmythology.com/images/mythology/zeus_s_lovers_large_image_76.jpg,,D,"Orion’s origin differs, but the general story told is that he is the son of Perseus and Euryale.",Hercules,Helen of Troy,Artemis,Orion,Persephone
FALSE,FALSE,2a,,3,MC,"The sweet cookie and cream snack, Oreos, are actually a knock off of the original chocolate sandwich cookie, Hydrox, which was created in 1908. What’s the name of the Walmart ‘Great Value’ knockoff of Oreos?
",https://www.cnet.com/a/img/Ig_LrV2UL_0-2Zc1KTUIEyFfFYU=/2021/09/08/4479ee22-fb76-409e-bf22-302270f7baa3/pokemon-oreo.jpg,,D,"Funfact: Double Stuf Oreos do not actually have double the amount of stuff. A highschool experiment in 2013 found that on average they have about 1.86 times the amount of filling as regular Oreos.
",Zebra cookies,Oruos,Cremos,Twist & Shout,Clorox
FALSE,FALSE,2a,,4,MC,"The Battle of Hastings is known for changing the English language as we know it today. In this battle, which group came out as victorious, taking over the higher powers of 11th Century England?",http://c.files.bbci.co.uk/5731/production/_91912322_hi035716367.jpg,,A,,Normans,Anglo-Saxons,Vikings,Gauls,Spanish
FALSE,FALSE,2a,,5,MC,"What is the name of Stephanie Meyer’s Twilight remake, told from the perspective of Edward Cullen rather than Bella Swan? ",https://m.media-amazon.com/images/M/MV5BMTQ2NzUxMTAxN15BMl5BanBnXkFtZTcwMzEyMTIwMg@@._V1_.jpg,,A,"Each Twilight book is based on classic love stories, like Pride and Prejudice, Romeo and Juliet, Wuthering Heights, and A Midsummer Night’s Dream.",Midnight Sun,Midday Moon,Solar Eclipse,Lunar Eclipse,Rising Star
FALSE,FALSE,2a,,6,MC,"In the iconic film The Matrix, green “code” can be seen falling from the sides of the screen to represent the Matrix’s activity. But where does this “code” come from? ",https://i.imgflip.com/twldy.jpg,,B,"A production designer scanned symbols from his wife’s sushi cookbooks, then manipulated them to craft the “code”. ",Japanese Proverbs,Sushi Recipes,C++,C#,The Instruction Manual for a jetski
FALSE,FALSE,2a,,7,MC,"Red foxes have a reputation for being cunning and intelligent, as portrayed in pop culture including Incredible Mr. Fox and the Disney adaptation of Robin Hood. What is the scientific name for a red fox?",https://cdn2.bulbagarden.net/upload/thumb/6/60/037Vulpix.png/1200px-037Vulpix.png,,B,"The creature pictured is Vulpix, a Pokemon, whose name is directly derived from the scientific name for a red fox: Vulpes vulpes!",Sus scrofa,Vulpes vulpes,Ursus arctos,Chiroptera,The Battle of the Labyrinth
FALSE,FALSE,2a,,8,MC,"Doja Cat is one of the most popular artists today, and recently dropped Planet Her. She also recently hosted the 2021 VMAs, where she displayed her fun personality in all these outfits except which of the following?",https://cdn.vox-cdn.com/thumbor/3cTZNewybseTwwq_M907cIxFsHQ=/1400x1400/filters:format(jpeg)/cdn.vox-cdn.com/uploads/chorus_asset/file/22700008/640x640__8_.jpg,,E,,Worm,Chair,Turkey,Red dress,Alien
FALSE,FALSE,2a,,9,MC,"In 2019, during the League of Legends World Championships, which team was the first runner up, losing to FunPlus Phoenix?",https://static.invenglobal.com/upload/image/2019/11/10/o1573402314494490.jpeg,,C,"The first ever large-scale gaming competition was held by Atari in 1980, called The Space Invaders Championship.",Invictus,T1,G2,Fnatic,Damwon
FALSE,FALSE,2a,,10,MC,Something unique about US sports is the annual draft where college athletes instead of club academies like in Europe. Which college team has won the most NCAA American Football championships?,https://upload.wikimedia.org/wikipedia/en/thumb/4/4c/College_Football_Nat%27l_Championship_logo.svg/1200px-College_Football_Nat%27l_Championship_logo.svg.png,,A,"Yale has 18 NCAA titles, all from the late 1800s to early 1900s. As of recent years, Alabama have almost caught up with 16 titles",Yale,Alabama,Princeton,Notre Dame,Michigan
TRUE,FALSE,2a,,11,SA,The world record for solving a rubik's cube is 3.47 seconds. Computers have also figured out that no position in the rubik's cube requires more how many moves to solve?,https://m.media-amazon.com/images/I/81dIEAgoytL._AC_SL1500_.jpg,,20,"Known as God's Number, it took 35 CPU years and many man hours to solve. The current record held for the fastest solve by a human is 3.47 seconds by Yusheng Du.",,,,,
TRUE,FALSE,2a,,12,SA,"According to a popular vine, at which resturant can you get ""FR E SH A VOCA DO""?",https://solidstarts.com/wp-content/uploads/introducing-avocado-to-babies.jpg,,Del Taco,,,,,,
FALSE,FALSE,2b,,0,MD,,,,,,,,,,
FALSE,FALSE,2b,,13,MC,"This medium-sized penguin species was named after the wife of the explorer who discovered them, Jules Dumont d’Urville. Also distinguishable by the white ring surrounding their eyes, what is the name of this species?",https://upload.wikimedia.org/wikipedia/commons/e/e3/Hope_Bay-2016-Trinity_Peninsula%E2%80%93Ad%C3%A9lie_penguin_%28Pygoscelis_adeliae%29_04.jpg,,C,,Flordland,King,Adélie,Gentoo,Snares
FALSE,FALSE,2b,,14,MC,The cat being held in the opening scene of the Godfather was not originally called for in the script. Who did this cat belong to?,https://m.media-amazon.com/images/M/MV5BM2MyNjYxNmUtYTAwNi00MTYxLWJmNWYtYzZlODY3ZTk3OTFlXkEyXkFqcGdeQXVyNzkwMjQ5NzM@._V1_.jpg,,C,"Director Francis Ford Coppola found the cat in the studio and handed it to Marlon Brando before the shot. The cat stayed in his lap and purred so loudly that the crew was afraid the noise would drown out the dialogue.
",Francis Ford Coppola,Diane Keaton,No one - the cat was a stray,Al Pachino,Marlon Brando
FALSE,FALSE,2b,,15,MC,The flag of Qatar has the largest width to height ratio of 2.545. Select all of the following countries that have a flag with a 1:1 aspect ratio.,https://upload.wikimedia.org/wikipedia/commons/thumb/6/65/Flag_of_Qatar.svg/1280px-Flag_of_Qatar.svg.png,,"A,E",,Switzerland,Belarus,Israel,North Macedonia,Vatican City
FALSE,FALSE,2b,,16,MC,"In chess, each piece is given a number to represent their relative value and approximate advantages at any given position. If you have your opponent's two knights, a pawn, and their queen, how many points do you have?",https://i.redd.it/25zmyphf3stz.jpg,,C,"The minor pieces (bishops and knights) are worth 3, pawns are worth 1, rooks are worth 5, and the queen is worth 9",4,7,16,24,52
FALSE,FALSE,2b,,17,MC,There are two types of competitive pool configurations: short course and long course. How many laps would a 100 yard race be in a long course pool? ,https://coachrickswimming.files.wordpress.com/2014/03/50-m-pool.jpg,,B,,1,2,3,4,5
FALSE,FALSE,2b,,18,MC,"While it has spawned many sequels and related series, the Percy Jackson series official has five books. What is the name of the third book in the series?",https://static.wikia.nocookie.net/olympians/images/1/10/Percy_Jackson.jpg/revision/latest?cb=20180319172727,,B,,The Last Olympian,The Titan's Curse,The Sea of Monsters,The Lighting Thief,The Battle of the Labrynth
FALSE,FALSE,2b,,19,MC,"Pokemon is actually an abbreviation of “Pocket Monsters” in Japan. Released in 1996, there have been eight different regions. Each region has its own unique professor, but all have been named under what category?",https://cdn2.bulbagarden.net/upload/thumb/d/d0/Omega_Ruby_Alpha_Sapphire_Professor_Birch.png/1200px-Omega_Ruby_Alpha_Sapphire_Professor_Birch.png,,B,"Such professors include: Prof, Oak, Birch, Sycamore, Elm, Ivy, Rowan, Juniper, Kukui, and Willow!",Rocks,Plants,Bodies of water,Pokemon types,Mountain ranges
FALSE,FALSE,2b,,20,MC,"Christmas is officially in 22 days! In addition to the other eleven gifts, what did my true love give to me on the twelvth day of Christmas?",https://i1.wp.com/doodlewash.com/wp-content/uploads/2020/12/Day-21-Partridge-In-A-Pear-Tree-Watercolor-Illustration-Painting.jpg?fit=1024%2C783&ssl=1,,B,,Twelve calling birds,Twelve drummers drumming,Twelve geese a-laying,Twelve pipers piping,Twelve lords a-leaping
FALSE,FALSE,2b,,21,MC,The last Olympics debuted several new sports. Which of the following events debuted at the 2020 Tokyo Olympics?,https://stillmed.olympics.com/media/Images/OlympicOrg/News/2017/06/09/2017-06-09-tokyo2020-thumbnail.jpg?interpolation=lanczos-none&resize=2120:1200,,C,"Karate was added as a specialty sport for the 2020 Tokyo Olympics by choice of the host nation, along with sport climbing, skateboarding, and surfing.
",Open-water swimming,Taekwondo,Karate,Pentathlon,Judo
FALSE,FALSE,2b,,22,MC,"Albert Einstein, considered by many as one of the greatest minds in history, was born in 1879 on what day which coincidentally is Steven Hawkings', another leading mind in science, death day?",https://cdn.mos.cms.futurecdn.net/vjY92E9DK6egmKYgoZSToS.jpg,,C,"Yes, Albert Einstein was born on pi day! Coincidence or fate?",January 20th,February 6th,March 14th,June 28th,August 31st
TRUE,FALSE,2b,,23,SA,"This landmark was completed on 1869, and revolutionized ship routes between Europe and Asia. It was also blocked last year, holding up trade valued more than 9 billion dollars per day.",https://image.cnbcfm.com/api/v1/image/106860121-1616780983446-106860121-1616772119794-02_close_up_view_of_ever_given_ship_suez_canal_26march2021_wv2.jpg?v=1616781003,,Suez Canal,,,,,,
TRUE,FALSE,2b,,24,SA,"Recently, Taylor Swift has been re-recording her latest albums. She's included additional special features, ""From the Vault"" tracks, and extended versions of certain songs. Which album did she most recently re-release?",https://images.wsj.net/im-434099?width=1280&size=1,,Red,,,,,,
FALSE,FALSE,2c,,0,MD,,,,,,,,,,
FALSE,FALSE,2c,,25,MC,"The show BoJack Horseman integrates a society of humans and animals, featuring characters like Princess Carolyn, a cat, a dog, and of course BoJack Horseman, a horse. What animal is the character Wanda Pierce?",https://m.media-amazon.com/images/M/MV5BYWQwMDNkM2MtODU4OS00OTY3LTgwOTItNjE2Yzc0MzRkMDllXkEyXkFqcGdeQXVyMTkxNjUyNQ@@._V1_.jpg,,D,Bojack Horseman was nominated for 3 Emmys and didn't win any.,Axolotl,Mouse,Human,Owl,Penguin
FALSE,FALSE,2c,,26,MC,"Tomorrow is December 4th, which is also Jay-Z's birthday! He is turning 52, which does NOT numerically classify which of the following?",https://static.billboard.com/files/2020/12/jay-z-roc-nation-brunch-2020-billboard-1548-1607102538-compressed.jpg,,E,,Complete weeks in a year,White keys on a piano,Cards in a standard deck,Atomic number of tellurium,Current electoral votes of California
FALSE,FALSE,2c,,27,MC,There are many celebrities that are part time owners of a multitude of sports franchises such as Will Smith and the 76ers. Which NBA star is a part time owner of Premier League team Liverpool?,https://upload.wikimedia.org/wikipedia/en/thumb/0/0c/Liverpool_FC.svg/1200px-Liverpool_FC.svg.png,,E,"Lebron reportedly owns 2% of the Reds, which he bought in 2011",Steve Nash,Magic Johnson,James Harden,Kevin Durant,Lebron James
FALSE,FALSE,2c,,28,MC,"Alaska is known for being far north above the U.S., but within the Continental United States, which state can you find the northernmost point ?",https://upload.wikimedia.org/wikipedia/commons/thumb/8/84/Alaska_in_United_States_%28US50%29.svg/1200px-Alaska_in_United_States_%28US50%29.svg.png,,D,"This part of Minnesota isn't even connected to the rest of Minnesota, and it is part of the US due to a mistake by the first mapmakers in the area",Maine,Washington,Montana,Minnesota,Michigan
FALSE,FALSE,2c,,29,MC,Jules Verne wrote a novel called Twenty Thousand Leagues Under the Sea following the plights of Captain Nemo. A league is a measure of what?,https://www.australiangeographic.com.au/wp-content/uploads/2021/08/giant-squid-facts-1-scaled.jpg,,C,"Captain Nemo, the main character, is actually a reference to the Odyssey.",TIme,Depth,Length,Weight,Speed
FALSE,FALSE,2c,,30,MC,Among the most famous memes is the Doge meme which was often accompanied with broken English typed in multicolored Comic Sans. What breed of dog is depicted in this classic meme?,https://static01.nyt.com/images/2019/10/13/fashion/00COMICSANS/00COMICSANS-videoSixteenByNineJumbo1600.jpg,,A,,Shiba Inu,Shikoku Ken,Japanese Spitz,Finnish Spitz,Kugsha
FALSE,FALSE,2c,,31,MC,"The human brain is responsible for every aspect of life despite only weighing 3 pounds, the size of a two-slice toaster. Which brain system is responsible for memory and emotions?",https://cdn.britannica.com/q:60/16/170816-050-0FB450D3/Brain-illustration.jpg,,E,The largest human brain recorded weighed in at around 5 pounds.,Olfactory system,Gustatory system,Vestibular system,Nervous system,Limbic system
FALSE,FALSE,2c,,32,MC,"Christiano Ronaldo has recently passed the men’s record for most international goals scored, and as of October 26th he has 115 goals in 182 caps. Who held this record previously for 17 years?",https://imgresizer.eurosport.com/unsafe/2560x0/filters:format(jpeg)/origin-imgresizer.eurosport.com/2021/09/11/3216973-65894728-2560-1440.jpg,,D,"Ronaldo has recently returned to Manchester United, where he won 9 trophies between 2003-2009.",Diego Maradona,Pele,Lionel Messi,Ali Daei,Harry Kane
FALSE,FALSE,2c,,33,MC,"In the 1840s, a musical inventor combined woodwind and brass instruments. In 1846, the invention of the saxophone was patented. Who was the Belgian designer who invented the saxophone?
",https://upload.wikimedia.org/wikipedia/commons/b/b7/Sergey_Stepanov_-_Epic_Sax_Guy_-_May_28%2C_2010.jpg,,C,"Though they’ve always been made of brass, the saxophone is classified as a woodwind because of the way it’s played. Also, it’s one of few widely used instruments that were invented by a single person.
","Jean Baptiste
","David Saxon
","Adolphe Sax
",Randall Sax,Bartolomeo Cristofori
