Timed,InstantFeedback,Round,Category,Q,Type,Question,Image,Media,Answer,Details,OptA,OptB,OptC,OptD,OptE
FALSE,FALSE,2c,,34,MC,"Vitamins are micronutrients that are essential for human metabolism, however, most are obtained through the diet since we cannot make them. Out of the following, identify two vitamins that humans are able to synthesize.",https://post.healthline.com/wp-content/uploads/2020/01/vitamins-pills-bottle-732x549-thumbnail.jpg,,"B,E","The human body can make Vitamin B3 from the amino acid tryptophan. It can also create Vitamin D just from being in the sunlight! UVB radiation converts a precursor into pre-Vitamin D in the skin. 
",Vitamin A,Vitamin B3,Vitamin B12,Vitamin C,Vitamin D
TRUE,FALSE,2c,,35,SA,"During WWII, the US Marines needed to send cryptic messages overseas, but struggled to find a code that was unbreakable. What language did the US use to help encrypt messages that were considered unbreakable?",https://upload.wikimedia.org/wikipedia/commons/thumb/8/84/Alaska_in_United_States_%28US50%29.svg/1200px-Alaska_in_United_States_%28US50%29.svg.png,,Navajo,,,,,,
TRUE,FALSE,2c,,36,SA,"Also the name of the singer who sang “DJ Got Us Fallin’ In Love”, the name of the Edgar Allen Poe short story is “The Fall of the House of” what?",https://www.nps.gov/common/uploads/people/nri/20170922/people/A4A85482-1DD8-B71B-0B7F160BECA37FC5/A4A85482-1DD8-B71B-0B7F160BECA37FC5.jpg,,Usher,Usher's real name is actually Usher,,,,,
FALSE,FALSE,2d,,0,MD,,,,,,,,,,
FALSE,FALSE,2d,,37,SA,"There are a lot of exotic fruits, but this stinky fruit has different names for its varieties including “Red Prawn”, “XO”, and “Musang King” which is the most popular variety of this fruit in Malaysia.",https://i.ytimg.com/vi/s77tsEcW6wg/maxresdefault.jpg,,E,"Durian’s pungent smell has made it illegal on public transit in Singapore. But despite this, people in SE Asia love it!",Jackfruit,Guava,Snakefruit,Rambutan,Durian
FALSE,FALSE,2d,,38,MC,Dynastic rule in China ended in 1912 with the rise of the Republic of China. What was the last Chinese dynasty?,https://scmillhills.com/wp-content/uploads/sites/5/2017/03/158644-ancient-chinese-clothing.jpg,,E,Dynastic rule in China lasted nearly four million years,Jin,Ming,Yuan,XI,Qing
FALSE,FALSE,2d,,39,MC,"Students in the Harry Potter universe were not exempt from standardized tests. They had two separate standardized tests, but what was the name for the test Hogwarts students took during their 7th year?",https://static.wikia.nocookie.net/harrypotter/images/4/4e/OWLS_1996.jpg/revision/latest?cb=20180212192232,,C,"A.K.A ""Nastily Exhausting Wizarding Tests"", these tests had 6 levels of achievement, the highest being “O” for “outstanding” and the lowest being “T” for “troll”",O.W.L.,W.A.N.D.,N.E.W.T.,W.W.N.,S.P.E.W.
FALSE,FALSE,2d,,40,MC,"The Met Gala is one of the most iconic fashion events of every year, with this year's theme being “In America: A Lexicon of Fashion”. What was the Met Gala’s 2016 theme?",https://media.allure.com/photos/61391a92eccf05d64de28f6c/16:9/w_2560%2Cc_limit/met%2520gala.jpg,,B,The first Met Gala was in 1948 to raise money for the Met's Costume Institute.,Punk: Chaos to Couture,Manus X Machina,Heavenly Bodies: Fashion and the Catholic Imagination,Camp: Notes on Fashion,China: Through the Looking Glass
FALSE,FALSE,2d,,41,MC,Scientific measurements are the cornerstone of many of the advancements we have today. What does a goniometer measure?,https://i0.wp.com/blog.treasurie.com/wp-content/uploads/2019/08/measuring-tools-5.jpg,,A,,Angles ,Distance ,Gases,Solar radiation ,Entropy transfer 
FALSE,FALSE,2d,,42,MC,"The first purchase made on the internet was made by Stanford students from an artificial intelligence lab, who bought what item from MIT students in 1972?",https://yt3.ggpht.com/ytc/AKedOLTf2JSL9duSWPgClQZsn2QuIB862KmzLlKx6kcQ=s900-c-k-c0x00ffffff-no-rj,,A,,A bag of weed,Mariah Carey tapes,Moon shoes,Quantum mechanics textbooks,Mood rings
FALSE,FALSE,2d,,43,MC,"On December 18th of this year, NASA is planning on launching the successor to The Hubble as the main space telescope after 31 years. What is the name of this space telescope? ",http://www.nasa.gov/sites/default/files/thumbnails/image/potw2138a.jpg,,E,"It is said that the James Webb Space Telescope is 100x more powerful than the Hubble, and may be able to see the universe's first galaxies and possible life on the exoplanets the Hubble discovered",The Carl Sagan Space Telescope,The Grumman Space Telescope,The Northrop Space Telescope,The Dubble,The James Webb Space Telescope
FALSE,FALSE,2d,,44,MC,"Yuzuru Hanyu is one of the most decorated figure skaters in the world, winning 12 gold medals in his 13 year international career. What is the most difficult skating jump Yuzuru has landed in competition?",https://www.washingtonpost.com/wp-apps/imrs.php?src=https://arc-anglerfish-washpost-prod-washpost.s3.amazonaws.com/public/62Q54IOMAE7RXKMNQDM4YNLHOM.jpg&w=1200,,D,"The Axel is the hardest jump in figure skating, as it requires the skater to make almost another half rotation.",Triple Lutz,Quadruple look,Quadruple Salchow,Quadruple Lutz,Triple Axel
FALSE,FALSE,2d,,45,MC,Pixar has produced a range of iconic movies from Ratatouille to Cars. What California School is Monsters University based off of?,https://www.tvguide.com/a/img/catalog/provider/1/2/1-3490578086.jpg,,E,,University of California Mercad ,Stanford University ,University of Los Angeles ,Claremont McKenna ,UC Berkeley 
FALSE,FALSE,2d,,46,MC,"The 2021 United Nations Climate Change Conference ended on November 12, 2021. This date is also National Pizza With Everything (Except Anchovies) Day. Select all of the categories Anchovies can be classified under.",https://cdn.bluefoot.com/starvin/images/Every-Topping-Pizza/everything-topping-pizza.jpg,,"B,C,E",,Mollusc,Chordate,Eukaryote,Vegetable,Fish
TRUE,FALSE,2d,,47,SA,"According to the Guinness World Records, which word has the most meanings in the English language based on the 1989 Oxford English Dictionary? ",https://www.sharecopia.com/images/memes5/oxford-dictionary-streets.jpg,,set,,,,,,
TRUE,FALSE,2d,,48,SA,What mathematical symbol could you place between 5 and 7 to get a number larger than 5 and smaller than 7?,"https://ih1.redbubble.net/image.911607820.6504/pp,840x830-pad,1000x1000,f8f8f8.jpg",,decimal,,,,,,
FALSE,FALSE,3,,0,MD,,,,,,,,,,
FALSE,FALSE,3,Colorado,1,MC,"Colorado is famous for its 58 14ers. What’s the highest mountain in Colorado, which reaches an elevation of 14,439'?",https://www.durango.com/wp-content/uploads/2020/02/colorado-14ers-fb.jpg,,B,Plateu mountains look like tall squares,Mount Massive,Mount Elbert,Pikes Peak,Horsetooth,Mount Harvard
FALSE,FALSE,3,Colorado,2,MC,"One Republic's song ""Counting Stars"" is one of the most viewed songs on youtube, with 3.4 billion views. One Republic is actually based out of which Colorado city?",https://pyxis.nymag.com/v1/imgs/8ee/9b2/daf79f1b992e86ab665acbbef7f7082c71-13-one-direction-friends.2x.rsocial.w600.jpg,,E,"despite it going viral on youtube, ""Counting Stars"" peaked at no. 2, falling behind TImber by Pitbull ft. Ke$ha",Denver,Pueblo,Aurora,Boulder,Colorado Springs
FALSE,FALSE,3,Colorado,3,MC,"Tonight, Jupiter sets at 10:15 p.m. (maybe you'll catch it after this!) in Fort Collins. It is visible to the naked eye, however, it's not the brightest object in our night sky. Which of the following planets appears brighter than Jupiter?",https://upload.wikimedia.org/wikipedia/commons/2/2b/Jupiter_and_its_shrunken_Great_Red_Spot.jpg,,B,"Jupiter currently has 53 named moons, and an estimated 79 total moons",Mercury,Venus,Mars,Saturn,Uranus
FALSE,FALSE,3,Colorado,4,MC,"Denver is known for its diverse range of foods, each representing or melting different cultures. What traditional American food was trademarked in Denver?",https://upload.wikimedia.org/wikipedia/commons/e/e8/Denver_skyline.jpg,,C,"On average, Denver gets about 300 days of sunshine a year",Hotdog ,Fries ,Hamburger ,Milkshake ,Mashed potatoes 
FALSE,FALSE,3,Colorado,5,MC,"It's official! The Fort Collins Old Town Target has just opened. Target is known for its striking red logo, which is one of the most recognized symbols in North America. What is the name of Target's logo-bearing mascot?",https://pbs.twimg.com/media/EQL5H7PW4AA6iEv.jpg,,B,Bullseye is the official mascot of Target Corporation. The dog is a Bull Terrier with a pure white coat and logo around her left eye.,Spot,Bullseye,Clifford,Fetch,Riley
FALSE,FALSE,3,Colorado,6,MC,"Colorado houses a range of conditions, perfect for a variety of agricultural products. Dove, a town located in southwest Colorado, is the self proclaimed world headquarter of what agricultural product?",https://www.denverpost.com/wp-content/uploads/2021/09/doves-019-2.jpg,,B,Pinto beans are the most widely produced beans in the US! they also contain the most fiber out of any bean!,Cantaloupe ,Pinto Beans ,Cucumbers,Chickpeas ,Corn 
FALSE,FALSE,3,Colorado,7,MC,"Poudre School District serves over 30,000 students around northern Colorado. Select all of the following are names of elementary schools in PSD? ",https://cdn.businessyab.com/assets/uploads/d51f7820c12b31c1e54ce3dcb1497196_-united-states-colorado-larimer-county-fort-collins-westchase-south-timberline-road-5844-bacon-elementary-school-970-488-5300.jpg,,"A,B,D",Poudre School District has 33 elementary schools.,Linton,Werner,Pikes,Irish,Harrington
FALSE,FALSE,3,Colorado,8,MC,"Today, there are four United States mints, including one in Denver! Now decommissioned, in which city were U.S. coins with an ""O"" minted?",https://www.usmint.gov/wordpress/wp-content/uploads/2018/03/Denver-Mint-1024x576.jpg,,C,The first one-cent piece was minted in 1793,Olympia,New Orleans,Omaha,Oklahoma City,
FALSE,FALSE,3,Colorado,9,MC,"Colorado boasts the highest mountain pass in the country, at an elevation of 12,183 feet. Following Highway 34, what is the name of this pass?",https://travel.home.sndimg.com/content/dam/images/travel/fullset/2012/03/11/d1/trail-ridge-road.rend.hgtvcom.1280.960.suffix/1491580735659.jpeg,,B,This trail was orginial used by the Ute and Arapaho tribes,Independence Pass,Trail Ridge Pass,Cottonwood Pass,Cumberland Pass,Loveland Pass
FALSE,FALSE,3,Colorado,10,MC,Denver Nuggets player Nikola Jokić is often known as “The Joker” nowadays. This nickname has also been given to which tennis player?,https://upload.wikimedia.org/wikipedia/commons/7/7e/Nikola_Jokic_free_throw_%28cropped%29.jpg,,A,"Jokic was actually a round 2, pick 41 draft in 2014, but has recently risen to become the 2020/21 NBA MVP.",Novak Djokvoic,Roger Federer,Rafael Nadal,Nenad Zimonjic,Andy Murray
FALSE,FALSE,3,Colorado,11,MC,"Colorado's state tree is the blue spruce, which is a super cool tree, but its wood is rarely used for wood because it's full of knots. The wood found in trees are composed of which of the following tissues?",https://upload.wikimedia.org/wikipedia/commons/1/11/Picea_pungens_tree.jpg,,C,"Secondary xylem is associated with lateral growth, and it shows annual rings in a tree. Its cell walls are thickened by lignin, which support the plants.",Primary xylem,Primary phloem,Secondary xylem,Secondary phloem,Parenchyma
FALSE,FALSE,3,Colorado,12,MC,"Denver proper has an area of 154 square feet and holds a population of 705,000. Which famous Denver road is the longest continuous street in the United States?",https://www.orangesmile.com/common/img_city_maps/denver-map-2.jpg,,E,The longest Highway in America is US Highway 20,Colorado Boulevard ,Quebec Street,Hampden Avenue,Federal Boulevard ,Colfax Avenue 
FALSE,FALSE,3,Colorado,13,MC,The largest gold plated dome in Colorado resides on the Colorado State Capitol. The 3rd largest dome resides on the Guggenheim Hall at Colorado School of Mines. What Colorado building has the second largest gold dome?,https://i1.wp.com/coloradopreservation.org/wp-content/uploads/2011/04/epp_2010_dome_2.jpg,,C,The Singapore National Stadium is currently the world's largest dome,Denver University ,The Brown Palace ,Casa Bonita ,Denver Mint ,US Air Force Academy Chapel 
FALSE,FALSE,3,Colorado,14,MC,"With the Rocky Mountains, Colorado has had a plethra of winter olympic atheletes train here, including Shaun White. Which Olympic snowboarder from Colorado used profanity on live TV after winning the gold medal?",https://www.coloradodirectory.com/downhillskiing/images/Skiing-Overview.gif,,C,"The event originated in 1998 in the Nagano, Japan Olympics",Hagan Kearney,Mick Dierdorf,Red Gerard,Arielle Gold,Chris Corning
FALSE,FALSE,3,Colorado,15,MC,Dutch Bros has been a source of energy for students and teachers alike. How many states does Dutch Bros serve “killer coffee” in?,https://ewscripps.brightspotcdn.com/dims4/default/fe89cb1/2147483647/strip/true/crop/970x546+0+65/resize/1280x720!/quality/90/?url=http%3A%2F%2Fewscripps-brightspot.s3.amazonaws.com%2Fe2%2F6b%2F36b2a7e44bb48ef469cf583f566f%2Fdutchbros1.jpg,,D,Dutch Bros was founded in 1992,3,5,6,9,11
FALSE,FALSE,3,Colorado,16,MC,"Colorado roads cut through some of the most unique and beautiful spots in the US, often at high elevations. What Colorado tunnel has the highest elevation in the United States?",https://i.ytimg.com/vi/pvqgTR3NjHg/maxresdefault.jpg,,D,The Eisenhower Tunnel carries Interstate 70 under the Continental Divide. ,Veterans Memorial Tunnel,Hanging Lake Tunnel ,Moffat Tunnel ,Eisenhower Tunnel ,Secret tunnel 
TRUE,FALSE,3,Colorado,17,SA,"Your elementary teacher may have told you that Colorado is a rectangle, but did you know Colorado has many more sides than that? How many sides does our colorful state have?",https://upload.wikimedia.org/wikipedia/commons/6/60/Colorado_in_United_States.svg,,697,"The shape of Colorado is what you would call a hexahectaenneacontakaiheptagon. It has many angles and bends, which makes it.... not a rectangle! ",,,,,
TRUE,FALSE,3,Colorado,18,SA,"While long gone, this animal thrived during the Jurassic period. It is currently Colorado's state fossil, whose name is which of the following?","https://assets.simpleviewinc.com/simpleview/image/fetch/c_fill,h_830,q_75,w_1200/https://assets.simpleviewinc.com/simpleview/image/upload/v1/clients/denver/denver-museum-nature-science-lobby_551d6d60-f0ae-5102-065bf5aa4c477cd7.jpg",,Stegosaurus,The stegosaurus was discovered in Colorado in 1876 by M.P. Felch,,,,,
FALSE,FALSE,4,,0,MD,,,,,,,,,,
TRUE,FALSE,4,,1,SA,"Camille Saint-Saens published one of his most famous works, The Carnival of the Animals, in 1886. His most famous piece from that collection is “Le cygne”. In English, what animal is le cygne?",https://upload.wikimedia.org/wikipedia/commons/9/98/Saint-Sa%C3%ABns-circa-1880.jpg,,The Swan,,,,,,
TRUE,FALSE,4,,2,SA,"This unit of data first became popular on the Ethereum blockchain. It is a file that exists digitally, sometimes in the form of digital art, video game items, or music. Taco Bell has even sold some. What is the name of these units?",https://pbs.twimg.com/media/FDoEwdvUUAA-6Qn?format=jpg&name=large,,"Non-Fungible Token, NFT",,,,,,
TRUE,FALSE,4,,3,SA,"This country’s islands of Santa Cruz and Isabela are home to giant tortoises and Darwin’s finches. Also consisting of the Galapagos Islands, which South American country is named for its position around zero latitude?",https://images.theconversation.com/files/152457/original/image-20170111-4604-bbpm9i.jpg?ixlib=rb-1.1.0&q=45&auto=format&w=926&fit=clip,,Ecuador,,,,,,
TRUE,FALSE,4,,4,SA,"In the history of the United States, there have been 46 presidents, although there have only been 45 presidents. Which is the only president to be counted as two presidents, for two noncontinuous terms?",https://i.natgeofe.com/k/06b7f432-322e-4ca9-8579-2eb6506f85b7/presidential-seal-president-job.jpg,,Grover Cleveland,,,,,,
TRUE,FALSE,4,,5,SA,"Bats locate objects with echolocation! Certain species have evolved to hear one frequency better than the rest, but to do so, bats must change the frequency of their screeches when they approach a target. This is to compensate for what phenomenon?",https://preview.redd.it/f0n1j4i9l9771.png?width=482&format=png&auto=webp&s=0a868224350010020ba8f877c6f18bd870d5a8bb,,Doppler Effect,,,,,,
TRUE,FALSE,4,,6,SA,"Marvel’s Phase 4 is underway, with new movies lined up for Thor, Spiderman, and many others. Yet, these heroes still have a name they go by when not saving the universe. Which hero goes by Janet van Dyne?",https://media.wonderlandmagazine.com/uploads/2021/05/ix59247c3h461.jpg,,Wasp,,,,,,
TRUE,FALSE,4,,7,SA,This 1965 Frank Herbert novel was recently made into a movie. The franchise has 14 books and is accredited as the founder of modern science fiction. It won a Hugo Award for Best Novel. The character Paul Artreides is played by Timothee Chalamet. What is the name of this novel?,https://erikhanberg.com/wp-content/uploads/2013/01/itzk450.jpeg,,Dune,,,,,,
TRUE,FALSE,4,,8,SA,"The Super Bowl is the championship game for the NFL and has been around since 1966. Yet, in more than half a century, what is the only team to have not played in the Super Bowl nor hosted it?",https://www.gannett-cdn.com/presto/2021/02/08/PDTF/5fe4d089-bd50-41f1-a6bb-f841f1938705-AP_Chiefs_Buccaneers_Super_B.jpg,,"Cleaveland Browns, Browns, Cleaveland",,,,,,
TRUE,FALSE,4,,9,SA,"The Valdivia Earthquake is the largest recorded earthquake in history with a magnitude of 9.5. According to the Richter scale, it releases how much more energy than an earthquake with ten times less amplitude or a magnitude of 8.5?",https://media.npr.org/assets/img/2016/08/17/chileearthquake2_custom-367dc4d33090151694f75c78f17a9e6ca4cfc96d-s1100-c50.jpg,,32,,,,,,
TRUE,FALSE,4,,10,SA,This Supreme Court case made its decision 1857. It declared the Missouri Compromise unconstitutional and stated that no African Americans could ever become a citizen. What was the full name of this case?,https://cdn.britannica.com/34/66834-050-2FC1E21E/Dred-Scott.jpg,,Dred Scott vs. Stanford,,,,,,
TRUE,FALSE,4,,11,SA,"Transylvania has belonged to a variety of empires and states through its history, and it is today most commonly associated with vampires. Most of Transylvania is now part of what modern-day country?",https://lp-cms-production.imgix.net/features/2015/08/BranCastle_Transylvania-d91a08d52fa2.jpg,,Romania,,,,,,
TRUE,FALSE,4,,12,SA,"This drink was introduced in 1988. It was originally marketed as a ""spice flavored drink"" like ginger ale. The name of the drink was ""Gold"". Which company, usually known for their lemon-lime sodas, produced this?",https://i.redd.it/fqobqmrfotx21.jpg,,7UP,,,,,,
TRUE,FALSE,4,,13,MC,"During the nuclear reaction of uranium-235, what subatomic particle is released? This particle is absorbed by other atoms of uranium-235, which cause a chain action by splitting apart and releasing more of the particle.",https://www.thoughtco.com/thmb/GrWPY8VtsBhFaG4-iyYfgucSuDA=/768x0/filters:no_upscale():max_bytes(150000):strip_icc()/atom-artwork-160936095-58a8f5683df78c345b8e53be.jpg,,Neutron,,,,,,
TRUE,FALSE,4,,14,SA,"This architect constructed the Mesa Lab in Colorado, which serves as the National Center for Atmospheric Research in Boulder. He was born in Guangzhou, China, and also created projects such as the Mile High Center and most famously, the Louvre Pyramid. What is his name?",https://upload.wikimedia.org/wikipedia/commons/3/31/National_Center_for_Atmospheric_Research_-_Boulder%2C_Colorado.jpg,,I.M. Pei,,,,,,